{
  "bridge_version": "0.2",
  "bridge_record_id": "brg_blocked_0001",
  "created_at": "2026-04-20T02:00:00Z",
  "updated_at": "2026-04-20T02:06:00Z",
  "status": "blocked_or_pending",
  "reason_codes": [
    "signature_verification_failed",
    "manual_audit_required"
  ],
  "sync_ids": {
    "correlation_id": "corr_blocked_0001",
    "rsl_report_id": "rslrep_blocked_0001",
    "trace_event_id": "trcev_blocked_0001",
    "inference_event_id": "inf_blocked_0001",
    "external_charge_event_id": "chg_blocked_0001",
    "royalty_settlement_id": null
  },
  "idempotency": {
    "idempotency_key": "idem_chg_blocked_0001",
    "dedupe_scope": "external_charge_event",
    "dedupe_hash": "sha256:2222222222222222222222222222222222222222222222222222222222222222",
    "replay_sequence": 2,
    "prior_event_ref": "chg_blocked_0001_retry_1"
  },
  "compatibility": {
    "spec_family": "rsl-kazene-bridge",
    "compatibility_level": "strict",
    "extension_namespace": [
      "kazene.dev/extensions",
      "ai-provider.example.com/bridge"
    ]
  },
  "access_snapshot": {
    "access_time": "2026-04-20T02:00:00Z",
    "requester_type": "ai_agent",
    "requester_id": "agent_blocked_0001",
    "asset_ref": "work_blocked_0001",
    "usage_context": "licensed_inference",
    "source_system": "license-gateway-02",
    "license_context": "rsl-standard-commercial",
    "usage_units": 1,
    "usage_unit_type": "request"
  },
  "external_charge_event": {
    "charge_time": "2026-04-20T02:00:02Z",
    "currency": "USD",
    "gross_amount": 1.40,
    "net_amount": 1.20,
    "tax_amount": 0.20,
    "billing_basis": "per_inference",
    "charge_status": "captured",
    "payer_ref": "acct_blocked_0001",
    "invoice_ref": "inv_blocked_20260420_0001"
  },
  "royalty_settlement": {
    "settlement_status": "not_ready",
    "settlement_amount": null,
    "settlement_currency": null,
    "settlement_memo": "Blocked because cryptographic verification failed."
  },
  "verification": {
    "signature_bundle": {
      "algorithm": "ed25519",
      "signed_fields": [
        "access_snapshot",
        "external_charge_event",
        "royalty_settlement"
      ],
      "signer": {
        "signer_type": "license_server",
        "signer_id": "did:example:license-server-blocked-01",
        "key_id": "key-7"
      },
      "signature": "base64:BLOCKEDEXAMPLESIGNATURE0001",
      "signed_at": "2026-04-20T02:00:03Z"
    },
    "verification_result": {
      "status": "failed",
      "checked_at": "2026-04-20T02:05:30Z",
      "verifier_id": "auditor_blocked_0001",
      "failure_reason": "signature_mismatch"
    }
  },
  "extensions": [
    {
      "extension_namespace": "ai-provider.example.com/bridge",
      "extension_key": "integrity_case_id",
      "value": "audit_case_20260420_0001",
      "compatibility_level": "compatible"
    }
  ]
}
